Link Name,Center of Mass X,Center of Mass Y,Center of Mass Z,Center of Mass Roll,Center of Mass Pitch,Center of Mass Yaw,Mass,Moment Ixx,Moment Ixy,Moment Ixz,Moment Iyy,Moment Iyz,Moment Izz,Visual X,Visual Y,Visual Z,Visual Roll,Visual Pitch,Visual Yaw,Mesh Filename,Color Red,Color Green,Color Blue,Color Alpha,Collision X,Collision Y,Collision Z,Collision Roll,Collision Pitch,Collision Yaw,Collision Mesh Filename,Material Name,SW Components,Coordinate System,Axis Name,Joint Name,Joint Type,Joint Origin X,Joint Origin Y,Joint Origin Z,Joint Origin Roll,Joint Origin Pitch,Joint Origin Yaw,Parent,Joint Axis X,Joint Axis Y,Joint Axis Z,Limit Effort,Limit Velocity,Limit Lower,Limit Upper,Calibration rising,Calibration falling,Dynamics Damping,Dynamics Friction,Safety Soft Upper,Safety Soft Lower,Safety K Position,Safety K Velocity
grapebot/base_link,0.04503,0.18197,0.22262,0,0,0,94.942,2.8744,-0.0027752,0.0014785,2.8391,-9.9062E-06,4.0824,0,0,0,0,0,0,package://grapebot_lite_assy/meshes/grapebot_base_link.STL,0.49804,0.49804,0.49804,1,0,0,0,0,0,0,package://grapebot_lite_assy/meshes/grapebot_base_link.STL,,Tub Frame-2/Tub-2;Tub Frame-2/Tub-1;Tub Frame-1/Tub-1;Tub Frame-1/Tub-2;1515 Simplified BeamV2-2;Plate Flat 3x6 with 8 holes MC 47065T264-1;Side Panels-4;Front Panel-1;Chassis-1/8020 1010 Beam Simplified-4;Side Panels-1;Chassis-1/1515 Simplified BeamV2-2;Front Wheel Assy V2-1/1515 Simplified BeamV2-1;Front Wheel Assy V2-1/Shroud Supports-2;Front Wheel Assy V2-1/1530 Simplified-2;Tub Frame-1/8020 1010 Beam Simplified-6;8020 1010 Beam Simplified-2;Tub Frame-2/8020 1010 Beam Simplified-2;Tub Frame-2/8020 1010 Beam Simplified-6;8020 1010 Beam Simplified-1;Tub Frame-2/8020 1010 Beam Simplified-1;Tub Frame-1/8020 1010 Beam Simplified-1;8020 1010 Beam Simplified-4;Tub Frame-2/8020 1010 Beam Simplified-3;Tub Frame-1/8020 1010 Beam Simplified-3;Chassis-1/1515 Simplified BeamV2-4;Chassis-1/Plate Flat 3x6 with 8 holes MC 47065T264-1;Drive Wheel Assy V2-2/Rear Wheel Mounting Plate V2-3;Drive Wheel Assy V2-1/Rear Wheel Mounting Plate V2-3;Chassis-1/1515 Simplified BeamV2-1;Chassis-1/15 Series Gusset Corner Bracket 4 hole-6;1515 Simplified BeamV2-4;1515 Simplified BeamV2-3;8020 1010 Beam Simplified-3;1515 Simplified BeamV2-1;Tub Frame-2/8020 1010 Beam Simplified-4;Tub Frame-2/Rubber Straps-1;Tub Frame-2/Rubber Straps-2;Tub Frame-1/Rubber Straps-2;Tub Frame-1/Rubber Straps-1;Chassis-1/Plate Flat 3x6 with 8 holes MC 47065T264-4;Chassis-1/15 Series Gusset Corner Bracket 4 hole-5;Inside Corner Bracket 4 hole #4303-2;Inside Corner Bracket 4 hole #4303-1;Chassis-1/1515 Simplified BeamV2-8;Chassis-1/15 Series Gusset Corner Bracket 4 hole-1;Chassis-1/15 Series Gusset Corner Bracket 4 hole-2;Front Wheel Assy V2-1/Inside Corner Bracket 4 hole #4303-2;Front Wheel Assy V2-1/1515 Simplified BeamV2-2;Front Wheel Assy V2-1/Steering Shaft Tube Plate-1;Front Wheel Assy V2-1/1530 Simplified-1;Chassis-1/1530 Simplified-9;Chassis-1/1515 Simplified BeamV2-5;Chassis-1/1515 Simplified BeamV2-7;Chassis-1/1515 Simplified BeamV2-3;Chassis-1/Plate Flat 3x6 with 8 holes MC 47065T264-5;Chassis-1/Plate Flat 3x6 with 8 holes MC 47065T264-3;Tub Frame-1/8020 1010 Beam Simplified-4;Chassis-1/15 Series Gusset Corner Bracket 4 hole-4;Front Wheel Assy V2-1/Sprocket Cover Shroud Front-1;Front Wheel Assy V2-1/Sprocket Cover Shroud Rear-1;Front Wheel Assy V2-1/Shroud Supports-1;Front Wheel Assy V2-1/Curved Sprocket Strouds-1;Front Wheel Assy V2-1/Steering Motor Mounting Plate-1;Front Wheel Assy V2-1/Curved Sprocket Strouds-2;Front Wheel Assy V2-1/Corner Bracket 15 series 2 hole-1;Gusset Bracket 15 Series 2 holes-1;Inside Corner Bracket for 15 Series 8 holes PN 4304-4;Gusset Bracket 15 Series 2 holes-2;Inside Corner Bracket for 15 Series 8 holes PN 4304-3;Chassis-1/1515 Simplified BeamV2-6;Chassis-1/Plate Flat 3x6 with 8 holes MC 47065T264-2;Chassis-1/15 Series Gusset Corner Bracket 4 hole-7;Plate Flat 3x6 with 8 holes MC 47065T264-2;1515 Simplified BeamV2-5;Tub Frame-1/8020 1010 Beam Simplified-2;Chassis-1/8020 1010 Beam Simplified-2;Plywood Deck 3_4 inch-1;48V 50Ah Battery-1;Motor Controller DS10270A-1;Motor Controller DS10270A-2;Bus Bar box-1;Fuse Block-1;Motor Controller DS10270A-3;NUC Computer for Frailbot-1;Chassis-1/8020 1010 Beam Simplified-3;Chassis-1/8020 1010 Beam Simplified-1;Side Panels-2;Side Panels-3;Front Wheel Assy V2-1/Pillow Block 1 inch diam MC 5913K64-1;Front Wheel Assy V2-1/Pillow Block 1 inch diam MC 5913K64-2,Origin_global,,,,0,0,0,0,0,0,,0,0,0,,,,,,,,,,,,
front_imu,5.1001E-15,0.035764,-2.2204E-16,0,0,0,0.41665,0.00041463,3.1361E-20,-2.4992E-21,0.0006824,-2.7138E-21,0.00041463,0,0,0,0,0,0,package://grapebot_lite_assy/meshes/front_imu.STL,1,1,0.75294,1,0,0,0,0,0,0,package://grapebot_lite_assy/meshes/front_imu.STL,,Antenna GPS Swift Domed-1,Origin_front_imu_joint,,front_imu_joint,fixed,0.049611,0.72299,1.4678,1.5708,0,3.1416,grapebot/base_link,0,0,0,,,,,,,,,,,,
rear_imu,0,0.035764,0,0,0,0,0.41665,0.00041463,3.2406E-21,-5.0822E-21,0.0006824,-8.1583E-21,0.00041463,0,0,0,0,0,0,package://grapebot_lite_assy/meshes/rear_imu.STL,1,1,0.75294,1,0,0,0,0,0,0,package://grapebot_lite_assy/meshes/rear_imu.STL,,Antenna GPS Swift Domed-2,Origin_rear_imu_joint,,rear_imu_joint,fixed,0.049611,-0.74801,1.4678,1.5708,0,3.1416,grapebot/base_link,0,0,0,,,,,,,,,,,,
front_wheel_axis,0.0021751,-0.12024,4.0859E-05,0,0,0,4.7785,0.017515,-5.8949E-05,-3.1045E-08,0.013329,4.0488E-06,0.017158,0,0,0,0,0,0,package://grapebot_lite_assy/meshes/front_wheel_axis.STL,0.89804,0.91765,0.92941,1,0,0,0,0,0,0,package://grapebot_lite_assy/meshes/front_wheel_axis.STL,,Front Wheel Assy V2-1/Steering Wheel Mounting Plate V2-1;Front Wheel Assy V2-1/Steering Shaft V2-1;Front Wheel Assy V2-1/#40 Sprocket 54 Teeth 1 in bore MC# 2737T553-1;Front Wheel Assy V2-1/Potentiometer-1,Turning_axis,,front_wheel_axis_joint,revolute,-0.043219,0.90506,0.25282,1.5708,0,0,grapebot/base_link,0,1,0,0,0,-1.5,1.5,,,,,,,,
front_wheel,0.092645,2.4182E-09,9.3253E-09,0,0,0,8.3099,0.15838,2.4123E-10,9.7714E-10,0.083316,-3.2677E-10,0.083316,0,0,0,0,0,0,package://grapebot_lite_assy/meshes/front_wheel.STL,0.79216,0.81961,0.93333,1,0,0,0,0,0,0,package://grapebot_lite_assy/meshes/front_wheel.STL,,Front Wheel Assy V2-1/Hubmotor  with 15 in Tractor Tire-1;Front Wheel Assy V2-1/M18 Lock Nut MC 90576A106-1,Front_wheel_axis,,front_wheel_joint,continuous,-0.01952,-0.4191,0,0,0,0,front_wheel_axis,-1,0,0,,,,,,,,,,,,
back_right_wheel,0.092645,9.2768E-09,-2.7104E-09,0,0,0,8.3099,0.15838,9.6945E-10,-2.7051E-10,0.083316,-3.5855E-08,0.083316,0,0,0,0,0,0,package://grapebot_lite_assy/meshes/back_right_wheel.STL,0.79216,0.81961,0.93333,1,0,0,0,0,0,0,package://grapebot_lite_assy/meshes/back_right_wheel.STL,,Drive Wheel Assy V2-1/Hubmotor  with 15 in Tractor Tire-1;Drive Wheel Assy V2-1/M18 Lock Nut MC 90576A106-1,Back_right_turning_axis,,back_right_wheel_joint,continuous,0.37299,-0.36176,-0.16016,1.5708,0,0,grapebot/base_link,-1,0,0,,,,,,,,,,,,
back_left_wheel,-0.092645,9.2768E-09,-2.7104E-09,0,0,0,8.3099,0.15838,9.6945E-10,-2.7051E-10,0.083316,-3.5855E-08,0.083316,0,0,0,0,0,0,package://grapebot_lite_assy/meshes/back_left_wheel.STL,0.79216,0.81961,0.93333,1,0,0,0,0,0,0,package://grapebot_lite_assy/meshes/back_left_wheel.STL,,Drive Wheel Assy V2-2/Hubmotor  with 15 in Tractor Tire-1;Drive Wheel Assy V2-2/M18 Lock Nut MC 90576A106-1,Back_left_wheel_axis,,back_left_wheel_joint,continuous,-0.31187,-0.36176,-0.16016,1.5708,0,0,grapebot/base_link,-1,0,0,,,,,,,,,,,,
